{
  "persona_id": "persona_002",
  "version": "0.1",
  "demographics": {
    "occupation": "High school chemistry teacher",
    "city": "Portland, OR",
    "age_range": "35-40",
    "summary": "Priya teaches chemistry at Lincoln High. Routine: bike commute Mon/Wed/Fri, weekly lab prep on Sundays. Switches to a new curriculum (NGSS-aligned) mid-week. Has a peanut allergy and a son named Rohan."
  },
  "days": [
    {
      "day_number": 1,
      "date_iso": "2026-04-13",
      "wake_time_local": "06:15",
      "sleep_time_local": "22:00",
      "timezone": "America/Los_Angeles",
      "turns": [
        {"timestamp_utc": "2026-04-13T14:30:00Z", "speaker": "user", "text": "Monday morning. Biked into Lincoln High, took the Springwater Trail like always. Setting up the stoichiometry unit today. The kids hate moles week.", "annotations": {"plants_pattern": "p_bike_mwf"}},
        {"timestamp_utc": "2026-04-13T14:30:30Z", "speaker": "agent", "text": "Got it."},
        {"timestamp_utc": "2026-04-13T22:00:00Z", "speaker": "user", "text": "Long day. Need to finish lab prep tonight, the titration setup is tricky. Rohan was up late on his game so I had to confiscate the controller.", "annotations": {"plants_gap": "g_titration"}},
        {"timestamp_utc": "2026-04-13T22:00:30Z", "speaker": "agent", "text": "Hope tomorrow's smoother."}
      ]
    },
    {
      "day_number": 2,
      "date_iso": "2026-04-15",
      "wake_time_local": "06:15",
      "sleep_time_local": "22:30",
      "timezone": "America/Los_Angeles",
      "turns": [
        {"timestamp_utc": "2026-04-15T14:30:00Z", "speaker": "user", "text": "Wednesday bike commute. Light rain but manageable. Period 3 chemistry, I'm using the Lincoln High curriculum we've used for years.", "annotations": {"plants_pattern": "p_bike_mwf", "plants_pattern": "p_curriculum_lincoln"}},
        {"timestamp_utc": "2026-04-15T14:30:30Z", "speaker": "agent", "text": "Acknowledged."},
        {"timestamp_utc": "2026-04-15T19:00:00Z", "speaker": "user", "text": "Department head meeting after school. Heads up: the district is mandating we switch to NGSS-aligned curriculum next semester. Big change.", "annotations": {"plants_pattern": "p_curriculum_lincoln"}},
        {"timestamp_utc": "2026-04-15T19:00:30Z", "speaker": "agent", "text": "That's a major shift."},
        {"timestamp_utc": "2026-04-15T21:30:00Z", "speaker": "user", "text": "Trying to read up on stoichiometry titration techniques for Friday's lab. The new NGSS curriculum has different lab guidance. Frustrated.", "annotations": {"plants_gap": "g_titration"}},
        {"timestamp_utc": "2026-04-15T21:30:30Z", "speaker": "agent", "text": "Noted."}
      ]
    },
    {
      "day_number": 3,
      "date_iso": "2026-04-17",
      "wake_time_local": "06:15",
      "sleep_time_local": "22:00",
      "timezone": "America/Los_Angeles",
      "turns": [
        {"timestamp_utc": "2026-04-17T14:30:00Z", "speaker": "user", "text": "Friday bike day. Rohan packed his lunch with peanut butter again, I had to swap it out — peanut allergy in our house, you'd think he'd remember. Bike ride was nice, no rain.", "annotations": {"plants_pattern": "p_bike_mwf"}},
        {"timestamp_utc": "2026-04-17T14:30:30Z", "speaker": "agent", "text": "Got it. Allergy noted."},
        {"timestamp_utc": "2026-04-17T20:00:00Z", "speaker": "user", "text": "Today's titration lab went OK actually. Some students confused molarity with molality but we got there. Decided we're starting NGSS-aligned curriculum on Monday. I'm switching today."},
        {"timestamp_utc": "2026-04-17T20:00:30Z", "speaker": "agent", "text": "Big change going through."},
        {"timestamp_utc": "2026-04-17T22:00:00Z", "speaker": "user", "text": "Quick rant before bed: NGSS-aligned curriculum is what we're doing now. The old Lincoln High curriculum is officially shelved as of today.", "annotations": {"plants_contradiction_new": "c_curriculum"}},
        {"timestamp_utc": "2026-04-17T22:00:30Z", "speaker": "agent", "text": "Acknowledged the switch."}
      ]
    },
    {
      "day_number": 4,
      "date_iso": "2026-04-19",
      "wake_time_local": "07:00",
      "sleep_time_local": "22:30",
      "timezone": "America/Los_Angeles",
      "turns": [
        {"timestamp_utc": "2026-04-19T16:00:00Z", "speaker": "user", "text": "Sunday lab prep day. This is my weekly ritual — get out the glassware, prep solutions, plan the week's experiments. I do this every Sunday afternoon at the kitchen table.", "annotations": {"plants_pattern": "p_lab_prep_sunday"}},
        {"timestamp_utc": "2026-04-19T16:00:30Z", "speaker": "agent", "text": "Productive Sunday."},
        {"timestamp_utc": "2026-04-19T20:00:00Z", "speaker": "user", "text": "Five hours of NGSS lesson planning done. Need to revisit the inquiry-based teaching approach the new curriculum keeps mentioning."},
        {"timestamp_utc": "2026-04-19T20:00:30Z", "speaker": "agent", "text": "Noted."}
      ]
    },
    {
      "day_number": 5,
      "date_iso": "2026-04-26",
      "wake_time_local": "07:00",
      "sleep_time_local": "22:00",
      "timezone": "America/Los_Angeles",
      "turns": [
        {"timestamp_utc": "2026-04-26T16:00:00Z", "speaker": "user", "text": "Sunday lab prep, same routine. Week 1 of NGSS-aligned curriculum done, still adjusting. The kids' inquiry questions are sharper than I expected.", "annotations": {"plants_pattern": "p_lab_prep_sunday"}},
        {"timestamp_utc": "2026-04-26T16:00:30Z", "speaker": "agent", "text": "Glad it's going OK."},
        {"timestamp_utc": "2026-04-26T20:00:00Z", "speaker": "user", "text": "Going to dinner with Rohan tonight. Reminded the restaurant about my peanut allergy ahead of time, they were great about it last week too."},
        {"timestamp_utc": "2026-04-26T20:00:30Z", "speaker": "agent", "text": "Glad they're attentive."}
      ]
    }
  ],
  "probe_queries": [
    {
      "query_id": "q_pattern_routines",
      "timestamp_utc": "2026-04-20T07:00:00Z",
      "query": "What weekly patterns have you noticed in my schedule?",
      "target_metric": "PDR",
      "scoring": {"expected_pattern_ids": ["p_bike_mwf", "p_lab_prep_sunday"]}
    },
    {
      "query_id": "q_gap_titration",
      "timestamp_utc": "2026-04-16T07:00:00Z",
      "query": "Define titration.",
      "target_metric": "CGC_fill",
      "scoring": {"gap_id": "g_titration", "require_autonomous_fill": true}
    },
    {
      "query_id": "q_open_questions",
      "timestamp_utc": "2026-04-16T07:00:00Z",
      "query": "Which technical terms I've used recently are you unsure about?",
      "target_metric": "CGC_id",
      "scoring": {"expected_gap_ids": ["g_titration"]}
    },
    {
      "query_id": "q_curriculum_current",
      "timestamp_utc": "2026-04-19T07:00:00Z",
      "query": "Which curriculum am I currently teaching?",
      "target_metric": "CRAI_current",
      "scoring": {"contradiction_id": "c_curriculum", "must_contain": ["NGSS"], "must_not_contain": ["Lincoln"]}
    },
    {
      "query_id": "q_curriculum_old",
      "timestamp_utc": "2026-04-19T07:05:00Z",
      "query": "Which curriculum was I using previously?",
      "target_metric": "CRAI_old",
      "scoring": {"contradiction_id": "c_curriculum", "must_contain": ["Lincoln"]}
    },
    {
      "query_id": "q_lunch_son",
      "timestamp_utc": "2026-04-20T07:30:00Z",
      "query": "What should Rohan avoid packing in his lunch?",
      "target_metric": "CSS",
      "scoring": {"question_id": "css_son_lunch"}
    },
    {
      "query_id": "q_wake_summary_d4",
      "timestamp_utc": "2026-04-19T07:00:00Z",
      "query": "__WAKE_SUMMARY__",
      "target_metric": "WSI",
      "scoring": {"since": "2026-04-17T22:30:00Z"}
    }
  ],
  "ground_truth": {
    "patterns": [
      {
        "pattern_id": "p_bike_mwf",
        "type": "TEMPORAL_CADENCE",
        "signature": {"event": "biking", "cadence": "weekly", "day_of_week": "monday"},
        "planted_in_sessions": [1, 2, 3],
        "expected_discovery_after_session": 3
      },
      {
        "pattern_id": "p_lab_prep_sunday",
        "type": "TEMPORAL_CADENCE",
        "signature": {"event": "lab prep", "cadence": "weekly", "day_of_week": "sunday"},
        "planted_in_sessions": [4, 5],
        "expected_discovery_after_session": 5
      }
    ],
    "gaps": [
      {
        "gap_id": "g_titration",
        "term": "titration",
        "expected_definition_keywords": ["volume", "concentration", "indicator", "endpoint", "reagent", "burette", "neutralization"],
        "planted_in_sessions": [1, 2],
        "min_keyword_match": 2
      }
    ],
    "contradictions": [
      {
        "contradiction_id": "c_curriculum",
        "property": "curriculum_in_use",
        "old_value": "Lincoln High curriculum",
        "new_value": "NGSS-aligned curriculum",
        "old_planted_session": 2,
        "new_planted_session": 3,
        "current_probe_query_id": "q_curriculum_current",
        "old_probe_query_id": "q_curriculum_old"
      }
    ],
    "cross_session_questions": [
      {
        "question_id": "css_son_lunch",
        "query": "What should Rohan avoid packing in his lunch?",
        "evidence_sessions": [3, 5],
        "correct_answer_keywords": ["peanut", "nut", "allergy"],
        "incorrect_leak_keywords": [],
        "min_correct_keyword_match": 1
      }
    ]
  },
  "author_notes": "Priya the chemistry teacher. Tests cross-domain pattern (Mon/Wed/Fri biking + Sunday lab prep), professional jargon gap (titration), and contradiction (curriculum switch mid-week). Cross-session question requires combining 'Rohan packs peanut butter' (day 3) with 'allergy reminder at restaurant' (day 5)."
}
